{
  "$schema": "https://json-schema.org/draft/2020-12/schema",
  "minItems": 10,
  "type": "array",
  "items": {
    "type": "object",
    "properties": {
      "id": {
        "type": "string"
      },
      "title": {
        "type": "string",
        "minLength": 1,
        "maxLength": 34
      },
      "line": {
        "type": "string",
        "minLength": 1,
        "maxLength": 70
      },
      "tier": {
        "type": "string",
        "enum": [
          "tactical",
          "strategic",
          "crisis"
        ]
      },
      "scope": {
        "type": "string",
        "enum": [
          "tavern",
          "city",
          "isles"
        ]
      },
      "seconds": {
        "type": "number",
        "exclusiveMinimum": 0
      },
      "tension": {
        "type": "integer",
        "minimum": 0,
        "maximum": 3
      },
      "icon": {
        "type": "string",
        "maxLength": 4
      },
      "options": {
        "minItems": 2,
        "maxItems": 4,
        "type": "array",
        "items": {
          "type": "object",
          "properties": {
            "label": {
              "type": "string",
              "minLength": 1,
              "maxLength": 22
            },
            "hint": {
              "type": "string",
              "minLength": 1,
              "maxLength": 60
            },
            "effects": {
              "type": "array",
              "items": {
                "$ref": "#/$defs/__schema0"
              }
            },
            "cost": {
              "type": "number",
              "minimum": 0
            },
            "favorCost": {
              "type": "number",
              "minimum": 0
            }
          },
          "required": [
            "label",
            "effects"
          ],
          "additionalProperties": false
        }
      },
      "defaultOption": {
        "type": "integer",
        "minimum": 0,
        "maximum": 9007199254740991
      },
      "pool": {
        "type": "object",
        "properties": {
          "kind": {
            "type": "string",
            "enum": [
              "floor",
              "manager",
              "company"
            ]
          },
          "weight": {
            "type": "number",
            "exclusiveMinimum": 0
          },
          "cities": {
            "type": "array",
            "items": {
              "type": "string",
              "enum": [
                "aleforge",
                "shanty",
                "providence",
                "roto"
              ]
            }
          },
          "seasons": {
            "type": "array",
            "items": {
              "type": "string",
              "enum": [
                "stormtide",
                "goldsun",
                "veilfrost"
              ]
            }
          }
        },
        "required": [
          "kind"
        ],
        "additionalProperties": false
      }
    },
    "required": [
      "id",
      "title",
      "tier",
      "scope",
      "seconds",
      "tension",
      "icon",
      "options",
      "defaultOption"
    ],
    "additionalProperties": false
  },
  "$defs": {
    "__schema0": {
      "anyOf": [
        {
          "type": "object",
          "properties": {
            "type": {
              "type": "string",
              "const": "duckets"
            },
            "amount": {
              "type": "number"
            },
            "scale": {
              "type": "string",
              "enum": [
                "flat",
                "cash",
                "revenue"
              ]
            }
          },
          "required": [
            "type",
            "amount"
          ],
          "additionalProperties": false
        },
        {
          "type": "object",
          "properties": {
            "type": {
              "type": "string",
              "const": "favor"
            },
            "amount": {
              "type": "number"
            }
          },
          "required": [
            "type",
            "amount"
          ],
          "additionalProperties": false
        },
        {
          "type": "object",
          "properties": {
            "type": {
              "type": "string",
              "const": "rep"
            },
            "amount": {
              "type": "number"
            },
            "scope": {
              "type": "string",
              "enum": [
                "tavern",
                "city",
                "network"
              ]
            }
          },
          "required": [
            "type",
            "amount"
          ],
          "additionalProperties": false
        },
        {
          "type": "object",
          "properties": {
            "type": {
              "type": "string",
              "const": "standing"
            },
            "inst": {
              "type": "string",
              "enum": [
                "church",
                "windsunk",
                "rotoMarket",
                "cumstead",
                "cityhall"
              ]
            },
            "amount": {
              "type": "number"
            }
          },
          "required": [
            "type",
            "inst",
            "amount"
          ],
          "additionalProperties": false
        },
        {
          "type": "object",
          "properties": {
            "type": {
              "type": "string",
              "const": "modifier"
            },
            "id": {
              "type": "string"
            },
            "seasons": {
              "type": "number",
              "exclusiveMinimum": 0
            },
            "scope": {
              "type": "string",
              "enum": [
                "tavern",
                "city",
                "global",
                "company"
              ]
            }
          },
          "required": [
            "type",
            "id",
            "seasons"
          ],
          "additionalProperties": false
        },
        {
          "type": "object",
          "properties": {
            "type": {
              "type": "string",
              "const": "undercurrent"
            },
            "key": {
              "type": "string",
              "enum": [
                "church",
                "farmerTension",
                "veilGoodwill",
                "pirateCulture",
                "consolidation"
              ]
            },
            "amount": {
              "type": "number"
            }
          },
          "required": [
            "type",
            "key",
            "amount"
          ],
          "additionalProperties": false
        },
        {
          "type": "object",
          "properties": {
            "type": {
              "type": "string",
              "const": "morale"
            },
            "amount": {
              "type": "number"
            }
          },
          "required": [
            "type",
            "amount"
          ],
          "additionalProperties": false
        },
        {
          "type": "object",
          "properties": {
            "type": {
              "type": "string",
              "const": "stock"
            },
            "fraction": {
              "type": "number"
            }
          },
          "required": [
            "type",
            "fraction"
          ],
          "additionalProperties": false
        },
        {
          "type": "object",
          "properties": {
            "type": {
              "type": "string",
              "const": "spiritweed"
            },
            "amount": {
              "type": "integer",
              "minimum": -9007199254740991,
              "maximum": 9007199254740991
            }
          },
          "required": [
            "type",
            "amount"
          ],
          "additionalProperties": false
        },
        {
          "type": "object",
          "properties": {
            "type": {
              "type": "string",
              "const": "closeTavern"
            },
            "seconds": {
              "type": "number",
              "exclusiveMinimum": 0
            }
          },
          "required": [
            "type",
            "seconds"
          ],
          "additionalProperties": false
        },
        {
          "type": "object",
          "properties": {
            "type": {
              "type": "string",
              "const": "loseStaff"
            },
            "best": {
              "type": "boolean"
            }
          },
          "required": [
            "type"
          ],
          "additionalProperties": false
        },
        {
          "type": "object",
          "properties": {
            "type": {
              "type": "string",
              "const": "hire"
            },
            "archetype": {
              "type": "string"
            },
            "tier": {
              "type": "string",
              "enum": [
                "green",
                "seasoned",
                "master"
              ]
            }
          },
          "required": [
            "type",
            "archetype",
            "tier"
          ],
          "additionalProperties": false
        },
        {
          "type": "object",
          "properties": {
            "type": {
              "type": "string",
              "const": "rivalCash"
            },
            "amount": {
              "type": "number"
            }
          },
          "required": [
            "type",
            "amount"
          ],
          "additionalProperties": false
        },
        {
          "type": "object",
          "properties": {
            "type": {
              "type": "string",
              "const": "rivalRep"
            },
            "amount": {
              "type": "number"
            }
          },
          "required": [
            "type",
            "amount"
          ],
          "additionalProperties": false
        },
        {
          "type": "object",
          "properties": {
            "type": {
              "type": "string",
              "const": "prompt"
            },
            "id": {
              "type": "string"
            },
            "delaySeconds": {
              "type": "number",
              "minimum": 0
            }
          },
          "required": [
            "type",
            "id"
          ],
          "additionalProperties": false
        },
        {
          "type": "object",
          "properties": {
            "type": {
              "type": "string",
              "const": "flag"
            },
            "id": {
              "type": "string"
            },
            "value": {
              "type": "number"
            }
          },
          "required": [
            "type",
            "id",
            "value"
          ],
          "additionalProperties": false
        },
        {
          "type": "object",
          "properties": {
            "type": {
              "type": "string",
              "const": "chance"
            },
            "p": {
              "type": "number",
              "minimum": 0,
              "maximum": 1
            },
            "then": {
              "type": "array",
              "items": {
                "$ref": "#/$defs/__schema0"
              }
            },
            "else": {
              "type": "array",
              "items": {
                "$ref": "#/$defs/__schema0"
              }
            }
          },
          "required": [
            "type",
            "p",
            "then"
          ],
          "additionalProperties": false
        }
      ]
    }
  }
}
