[
  { "id": "rival-undercut", "title": "{rival} cuts prices", "line": "Their {category} undercuts yours in {city}.", "tier": "tactical", "scope": "tavern", "seconds": 18, "tension": 1, "icon": "⇩",
    "options": [
      { "label": "Match", "effects": [{ "type": "modifier", "id": "price-war", "seasons": 1, "scope": "tavern" }] },
      { "label": "Promo night", "cost": 60, "effects": [{ "type": "duckets", "amount": -60 }, { "type": "modifier", "id": "promo-night", "seasons": 1, "scope": "tavern" }] },
      { "label": "Hold", "effects": [{ "type": "modifier", "id": "rival-promo", "seasons": 1, "scope": "tavern" }] }
    ], "defaultOption": 2 },

  { "id": "windsunk-tribute", "title": "Windsunk tribute due", "line": "The Council's collector is at your door.", "tier": "tactical", "scope": "tavern", "seconds": 16, "tension": 2, "icon": "⚓",
    "options": [
      { "label": "Pay", "cost": 110, "favorCost": 36, "effects": [{ "type": "duckets", "amount": -110 }, { "type": "standing", "inst": "windsunk", "amount": 6 }] },
      { "label": "Haggle", "effects": [{ "type": "chance", "p": 0.5, "then": [{ "type": "duckets", "amount": -50 }], "else": [{ "type": "standing", "inst": "windsunk", "amount": -10 }, { "type": "modifier", "id": "windsunk-grudge", "seasons": 1, "scope": "tavern" }] }] },
      { "label": "Refuse", "effects": [{ "type": "standing", "inst": "windsunk", "amount": -20 }, { "type": "modifier", "id": "windsunk-grudge", "seasons": 2, "scope": "tavern" }] }
    ], "defaultOption": 2 },

  { "id": "vow-trade", "title": "A Veilwalker offers a trade", "line": "Spiritweed, for a vow.", "tier": "tactical", "scope": "tavern", "seconds": 16, "tension": 1, "icon": "❦",
    "options": [
      { "label": "Swear the vow", "effects": [{ "type": "spiritweed", "amount": 4 }, { "type": "undercurrent", "key": "veilGoodwill", "amount": 12 }, { "type": "modifier", "id": "vow-bound", "seasons": 3, "scope": "company" }] },
      { "label": "Decline", "effects": [{ "type": "undercurrent", "key": "veilGoodwill", "amount": -3 }] },
      { "label": "Take and forget", "effects": [{ "type": "spiritweed", "amount": 4 }, { "type": "undercurrent", "key": "veilGoodwill", "amount": -22 }] }
    ], "defaultOption": 1 },

  { "id": "friar-inspection", "title": "The Friars come knocking", "line": "Inspection of your stock.", "tier": "tactical", "scope": "tavern", "seconds": 12, "tension": 2, "icon": "✝",
    "options": [
      { "label": "Comply", "effects": [{ "type": "modifier", "id": "friar-compliance", "seasons": 1, "scope": "tavern" }, { "type": "standing", "inst": "church", "amount": 5 }] },
      { "label": "Hide barrels", "effects": [{ "type": "chance", "p": 0.55, "then": [], "else": [{ "type": "closeTavern", "seconds": 20 }, { "type": "standing", "inst": "church", "amount": -15 }] }] },
      { "label": "Bribe", "cost": 90, "effects": [{ "type": "duckets", "amount": -90 }, { "type": "chance", "p": 0.8, "then": [{ "type": "standing", "inst": "church", "amount": 2 }], "else": [{ "type": "rep", "amount": -5 }, { "type": "standing", "inst": "church", "amount": -12 }] }] }
    ], "defaultOption": 1 },

  { "id": "bad-keg", "title": "A keg has turned", "line": "Sour smell from the cellar.", "tier": "tactical", "scope": "tavern", "seconds": 10, "tension": 1, "icon": "☠",
    "options": [
      { "label": "Dump it", "effects": [{ "type": "stock", "fraction": -0.1 }] },
      { "label": "Serve it", "effects": [{ "type": "chance", "p": 0.5, "then": [{ "type": "rep", "amount": -5 }], "else": [] }] }
    ], "defaultOption": 1 },

  { "id": "vip-last-round", "title": "One more round?", "line": "A big spender begs a pour past close.", "tier": "tactical", "scope": "tavern", "seconds": 8, "tension": 2, "icon": "★",
    "options": [
      { "label": "Pour it", "effects": [{ "type": "duckets", "amount": 40 }, { "type": "chance", "p": 0.35, "then": [{ "type": "duckets", "amount": -35 }, { "type": "rep", "amount": -2 }], "else": [{ "type": "rep", "amount": 2 }] }] },
      { "label": "Refuse", "effects": [{ "type": "rep", "amount": -2 }] }
    ], "defaultOption": 1 },

  { "id": "staff-raise", "title": "{staff} wants a raise", "line": "Morale is slipping behind the bar.", "tier": "tactical", "scope": "tavern", "seconds": 14, "tension": 1, "icon": "✋",
    "options": [
      { "label": "Grant", "cost": 40, "effects": [{ "type": "duckets", "amount": -40 }, { "type": "morale", "amount": 0.2 }] },
      { "label": "Refuse", "effects": [{ "type": "morale", "amount": -0.15 }, { "type": "chance", "p": 0.3, "then": [{ "type": "loseStaff" }] }] }
    ], "defaultOption": 1 },

  { "id": "shorelan-warning", "title": "Shorelan wardens sniffing", "line": "Someone saw tonic poured in Aleforge.", "tier": "tactical", "scope": "tavern", "seconds": 14, "tension": 2, "icon": "⚖",
    "options": [
      { "label": "Stop the tonic", "effects": [{ "type": "modifier", "id": "shorelan-raid", "seasons": 2, "scope": "tavern" }] },
      { "label": "Pay them off", "cost": 100, "effects": [{ "type": "duckets", "amount": -100 }, { "type": "standing", "inst": "cityhall", "amount": -3 }] },
      { "label": "Risk it", "effects": [{ "type": "chance", "p": 0.45, "then": [{ "type": "closeTavern", "seconds": 25 }, { "type": "duckets", "amount": -150 }], "else": [] }] }
    ], "defaultOption": 2 },

  { "id": "rival-poach", "title": "{rival} courts your staff", "line": "{staff} has an offer on the table.", "tier": "tactical", "scope": "tavern", "seconds": 14, "tension": 1, "icon": "✉",
    "options": [
      { "label": "Counter-offer", "cost": 60, "effects": [{ "type": "duckets", "amount": -60 }, { "type": "morale", "amount": 0.1 }] },
      { "label": "Let them go", "effects": [{ "type": "loseStaff", "best": true }] },
      { "label": "Call the bluff", "effects": [{ "type": "chance", "p": 0.5, "then": [], "else": [{ "type": "loseStaff", "best": true }] }] }
    ], "defaultOption": 1 },

  { "id": "rival-thugs", "title": "Word of hired thugs", "line": "{rival} is paying for trouble at yours.", "tier": "tactical", "scope": "tavern", "seconds": 14, "tension": 1, "icon": "✊",
    "options": [
      { "label": "Extra door", "cost": 50, "effects": [{ "type": "duckets", "amount": -50 }] },
      { "label": "Ignore", "effects": [{ "type": "modifier", "id": "thugs", "seasons": 1, "scope": "tavern" }] }
    ], "defaultOption": 1 },

  { "id": "rival-spoil", "title": "Cellar door jimmied", "line": "Someone got at your kegs overnight.", "tier": "tactical", "scope": "tavern", "seconds": 12, "tension": 1, "icon": "☠",
    "options": [
      { "label": "Dump the lot", "effects": [{ "type": "stock", "fraction": -0.4 }] },
      { "label": "Taste-test", "effects": [{ "type": "modifier", "id": "spoiled-kegs", "seasons": 2, "scope": "tavern" }, { "type": "rep", "amount": -2 }] }
    ], "defaultOption": 1 },

  { "id": "hall-contest", "title": "Hall of Ale brewing contest", "line": "Enter your best pour.", "tier": "tactical", "scope": "tavern", "seconds": 16, "tension": 0, "icon": "🏆",
    "options": [
      { "label": "Enter", "cost": 50, "effects": [{ "type": "duckets", "amount": -50 }, { "type": "chance", "p": 0.5, "then": [{ "type": "rep", "amount": 6 }, { "type": "standing", "inst": "cityhall", "amount": 8 }], "else": [{ "type": "rep", "amount": 1 }] }] },
      { "label": "Skip", "effects": [] }
    ], "defaultOption": 1 },

  { "id": "cumstead-contract", "title": "John Cum offers a contract", "line": "Grain, cheap, if you buy only from him.", "tier": "strategic", "scope": "isles", "seconds": 40, "tension": 0, "icon": "🌾",
    "options": [
      { "label": "Sign", "effects": [{ "type": "modifier", "id": "cumstead-contract", "seasons": 6, "scope": "company" }, { "type": "undercurrent", "key": "farmerTension", "amount": 12 }, { "type": "standing", "inst": "cumstead", "amount": 10 }] },
      { "label": "Smallholders", "effects": [{ "type": "modifier", "id": "smallholder-grain", "seasons": 6, "scope": "company" }, { "type": "undercurrent", "key": "farmerTension", "amount": -8 }, { "type": "standing", "inst": "cumstead", "amount": -6 }] },
      { "label": "Decline", "effects": [] }
    ], "defaultOption": 2 },

  { "id": "mgr-promo", "title": "{tavern}: run a promo?", "line": "Your manager wants a promo night.", "tier": "strategic", "scope": "tavern", "seconds": 45, "tension": 0, "icon": "✎",
    "options": [
      { "label": "Approve", "cost": 50, "effects": [{ "type": "duckets", "amount": -50 }, { "type": "modifier", "id": "promo-night", "seasons": 1, "scope": "tavern" }] },
      { "label": "Deny", "effects": [] }
    ], "defaultOption": 1 },

  { "id": "mgr-prices", "title": "{tavern}: raise prices?", "line": "Your manager thinks the room can bear it.", "tier": "strategic", "scope": "tavern", "seconds": 45, "tension": 0, "icon": "✎",
    "options": [
      { "label": "Approve", "effects": [{ "type": "modifier", "id": "price-up", "seasons": 2, "scope": "tavern" }] },
      { "label": "Deny", "effects": [] }
    ], "defaultOption": 1 },

  { "id": "mgr-bulk", "title": "{tavern}: buy kegs in bulk?", "line": "Cheaper kegs for a few seasons.", "tier": "strategic", "scope": "tavern", "seconds": 45, "tension": 0, "icon": "✎",
    "options": [
      { "label": "Approve", "cost": 80, "effects": [{ "type": "duckets", "amount": -80 }, { "type": "modifier", "id": "bulk-buy", "seasons": 3, "scope": "tavern" }] },
      { "label": "Deny", "effects": [] }
    ], "defaultOption": 1 },

  { "id": "election", "title": "Aleforge picks a mayor", "line": "Thatcher the historian is on the ballot.", "tier": "strategic", "scope": "isles", "seconds": 30, "tension": 0, "icon": "⚑",
    "options": [
      { "label": "Back Thatcher", "cost": 60, "effects": [{ "type": "duckets", "amount": -60 }, { "type": "standing", "inst": "cityhall", "amount": 15 }] },
      { "label": "Stay out", "effects": [] }
    ], "defaultOption": 1 },